{
  "name": "Aditya Gaur",
  "branch": "IT",
  "githubID": "adityaz26",
  "url": "https://github.com/adityaz26",
  "about": "I am a passionate and enthusiastic individual with a strong interest in technology and innovation. I enjoy exploring new ideas, learning new skills, and collaborating with others to create impactful solutions. In my free time, I love to read, travel, and engage in creative activities that allow me to express myself."
}
