{

 "name": "Aayushi Agarwal",
  "branch": "CSE(H)",
  "githubID": "aayushiag27",
  "url": "https://github.com/aayushiag27",
  "about": " I am a passionate coder and love to explore new technologies. I am currently learning web development and looking forward to contributing to open source projects. "
}
