{
  "name": "Aditya Gaur",
  "branch": "IT",
  "githubID": "adityaz26",
  "url": "https://github.com/adityaz26",
  "about": "I am a passionate and enthusiastic individual with a strong interest in technology and innovation. I enjoy exploring new ideas, learning new skills, and collaborating with others to create solutions."
}
